<?xml version="1.0" encoding="UTF-8"?>
<!DOCTYPE edl PUBLIC "-//OPENEMULATOR//DTD EDL 1.0//EN" "http://www.openemulator.org/DTDs/edl-1.0.dtd">
<edl version="1.0" generator="OpenEmulator" framework="700" label="Replica-1" image="images/Briel/Replica-1.png" description="The Replica-1 (www.brielcomputers.com) is a functional clone of the Apple-1 computer. It features a WDC 65C02 microprocessor, 32 kiB RAM (at $0000-$7FFF), and 8 kiB bytes ROM (BASIC at $E000-$EFFF, Krusader at $F000-$FEFF, Monitor at $FF00-$FFFF).">
    
    <device id="replica1" label="Replica-1" image="images/Briel/Replica-1.png">
        <setting ref="replica1.io" name="terminalSpeed" label="Terminal Speed" type="select" options="Standard,Enhanced"/>
        <setting ref="replica1.io" name="keyboardType" label="Keyboard" type="select" options="Standard,Full ASCII"/>
    </device>
    <port id="replica1.videoPort" ref="" type="Composite Video Port" group="peripherals" label="Video Port" image="images/Connectors/RCA Female.png">
        <inlet ref="replica1.terminal" property="monitorDevice" outletRef=""/>
        <inlet ref="replica1.terminal" property="monitor" outletRef="monitor"/>
    </port>
    <port id="replica1.slot1" ref="" type="Apple-1 Expansion Port" group="expansions" label="Expansion Port" image="images/Connectors/Edge44.png"/>
    <port id="replica1.slot2" ref="" type="Apple-1 Expansion Port" group="expansions" label="Expansion Port" image="images/Connectors/Edge44.png"/>
    <component id="replica1.controlBus" class="ControlBus">
        <property name="device" ref="replica1"/>
        <property name="audio" ref="audio"/>
        <!-- Clock frequency: 14318180 Hz * 61 / 910 -->
        <property name="clockFrequency" value="959790.088"/>
        <property name="cpuClockMultiplier" value="1"/>
        <property name="cpu" ref="replica1.cpu"/>
        <property name="resetOnPowerOn" value="1"/>
        <property name="powerState" value="0"/>
        <property name="resetCount" value="0"/>
        <property name="irqCount" value="0"/>
        <property name="nmiCount" value="0"/>
    </component>
    <component id="replica1.memoryBus" class="AddressDecoder">
        <property name="addressSize" value="16"/>
        <property name="blockSize" value="8"/>
        <property name="floatingBus" ref="replica1.floatingBus"/>
        <property name="refRAM" ref="replica1.ram"/>
        <property name="mapRAM" value="0x0000-0x7fff"/>
        <property name="refIO" ref="replica1.ioMemory"/>
        <property name="mapIO" value="0xd000-0xdfff"/>
        <property name="refROM" ref="replica1.rom"/>
        <property name="mapROM" value="0xe000-0xffff"/>
    </component>
    <component id="replica1.cpu" class="W65C02S">
        <property name="a" value="0x0"/>
        <property name="x" value="0x0"/>
        <property name="y" value="0x0"/>
        <property name="s" value="0x0"/>
        <property name="p" value="0x0"/>
        <property name="pc" value="0xff00"/>
        <property name="memoryBus" ref="replica1.memoryBus"/>
        <property name="controlBus" ref="replica1.controlBus"/>
    </component>
    <component id="replica1.floatingBus" class="FloatingBus">
        <property name="mode" value="ground"/>
    </component>
    <component id="replica1.ram" class="RAM">
        <property name="controlBus" ref="replica1.controlBus"/>
        <property name="image" data="${packagePath}/${id}.bin"/>
        <property name="size" value="0x8000"/>
    </component>
    <component id="replica1.ioMemory" class="AddressDecoder">
        <property name="addressSize" value="5"/>
        <property name="blockSize" value="4"/>
        <property name="floatingBus" ref="replica1.floatingBus"/>
        <property name="refPIA" ref="replica1.pia"/>
        <property name="mapPIA" value="0x10-0x1f"/>
    </component>
    <component id="replica1.pia" class="MC6821">
        <property name="controlBus" ref="replica1.controlBus"/>
        <property name="portA" ref="replica1.io"/>
        <property name="controlA" value="0x0"/>
        <property name="directionA" value="0x0"/>
        <property name="dataA" value="0x0"/>
        <property name="ca1" value="0"/>
        <property name="ca2" value="0"/>
        <property name="controlBusA" ref=""/>
        <property name="portB" ref="replica1.io"/>
        <property name="controlB" value="0x0"/>
        <property name="directionB" value="0x0"/>
        <property name="dataB" value="0x0"/>
        <property name="cb1" value="0"/>
        <property name="cb2" value="0"/>
        <property name="controlBusB" ref=""/>
    </component>
    <component id="replica1.io" class="Apple1IO">
        <property name="pia" ref="replica1.pia"/>
        <property name="terminal" ref="replica1.terminal"/>
        <property name="terminalSpeed" value="Enhanced"/>
        <property name="keyboardType" value="Standard"/>
    </component>
    <component id="replica1.terminalRAM" class="RAM">
        <property name="controlBus" ref="replica1.controlBus"/>
        <property name="image" data="${packagePath}/${id}.bin"/>
        <property name="size" value="1024"/>
        <property name="powerOnPattern" value="0x20"/>
    </component>
    <component id="replica1.terminal" class="Apple1Terminal">
        <property name="device" ref="replica1"/>
        <property name="vram" ref="replica1.terminalRAM"/>
        <property name="controlBus" ref="replica1.controlBus"/>
        <property name="monitorDevice" ref=""/>
        <property name="monitor" ref=""/>
        <property name="font" data="${resourcePath}/roms/Signetics/Signetics 2513 Video ROM.bin"/>
        <property name="cursorX" value="0"/>
        <property name="cursorY" value="0"/>
    </component>
    <component id="replica1.rom" class="ROM">
        <property name="image" data="${resourcePath}/roms/Briel/Replica-1 65C02 ROM.bin"/>
    </component>
    
</edl>
