<?xml version="1.0" encoding="UTF-8"?>
<!DOCTYPE edl PUBLIC "-//OPENEMULATOR//DTD EDL 1.0//EN" "http://www.openemulator.org/DTD/edl-1.0.dtd">
<edl version="1.0" label="Terminal" image="Terminal.png">

<device id="terminal" label="Terminal" image="Terminal.png" />
<connector id="terminal.connector" ref="" type="RS232" label="Connector" image="Serial Port Connector.png" />
<component id="terminal.io" class="Terminal">
    <property name="host" ref="hostEmulationController" />
    <property name="charset" ref="terminal.charset" />
    <property name="width" value="24" />
    <property name="height" value="40" />
</component>
<component id="terminal.charset" class="CharsetLoader">
    <property name="format" value="Signetics" />
    <property name="image" src="${resourcePath}/roms/Signetics/Signetics 2513 Video ROM.bin" />
</component>

</edl>
