<?xml version="1.0" encoding="UTF-8"?>
<!DOCTYPE edl PUBLIC "-//OPENEMULATOR//DTD EDL 1.0//EN" "http://www.openemulator.org/DTD/edl-1.0.dtd">
<edl version="1.0" label="Disk II Drive 1" image="Apple Disk II Drive.png">

<device id="diskII" label="Apple Disk II" image="images/apple2/Apple Disk II Drive.png" group="peripherals">
	<setting ref="diskII.drive" name="lock" type="checkbox" label="Lock" />
</device>
<connector id="diskII.connector" ref="" type="AppleIIDisk" label="Apple Disk II Slot Connector" />
<component id="diskII.drive" class="AppleDiskII">
    <property name="image" value="/Users/mressl/test2.dsk" />
    <property name="lock" value="0" />
    <property name="rpm" value="300.0" />
    <property name="rpmVariance" value="1.0" />
    <property name="soundSpin" src="sounds/Apple Disk II Spin.wav" />
    <property name="soundArm" src="sounds/Apple Disk II Arm.wav" />
    <property name="soundStop" src="sounds/Apple Disk II Stop.wav" />
    <property name="soundShake" src="sounds/Apple Disk II Shake.wav" />
</component>

</edl>
