<?xml version="1.0" encoding="UTF-8"?>
<!DOCTYPE edl PUBLIC "-//OPENEMULATOR//DTD EDL 1.0//EN" "http://www.openemulator.org/DTD/edl-1.0.dtd">
<edl version="1.0" label="Apple Joystick" image="Apple II Game Paddles.png">

<device id="joystick" label="Game Paddles" image="Apple II Game Paddles.png" />
    <setting ref="mousePaddles.port" name="source" type="select" options="Mouse,Joystick" label="Source" />
    <setting ref="mousePaddles.port" name="invertAxis" type="checkbox" label="Invert axis" />
</device>
<connector id="joystick.connector" ref="" type="AppleIIGame" label="Apple II Game Paddles" image="Apple II Game Paddles.png" />
<component id="joystick.port" class="AppleIIGamePaddles">
    <property name="host" ref="host" />
    <property name="invertAxis" value="0" />
</component>

</edl>
