<?xml version="1.0" encoding="UTF-8"?>
<!DOCTYPE edl PUBLIC "-//OPENEMULATOR//DTD EDL 1.0//EN" "http://www.openemulator.org/DTD/edl-1.0.dtd">
<edl version="1.0" generator="OpenEmulator" build="700" label="Apple Monitor III" image="images/Apple/Apple Monitor III.png" description="The Apple Monitor III is a CRT-based green monochrome 12-inch monitor manufactured by Apple Computer for the Apple III personal computer.">
    
    <device id="appleMonitorIII" label="Apple Monitor III" image="images/Apple/Apple Monitor III.png">
        <setting ref="appleMonitorIII.monitor" name="videoBrightness" label="Brightness" type="slider" options="-1.0,1.0"/>
        <setting ref="appleMonitorIII.monitor" name="videoContrast" label="Contrast" type="slider" options="0.0,1.0"/>
        <setting ref="appleMonitorIII.monitor" name="videoVerticalCenter" label="Vertical Center" type="slider" options="-0.1,0.1"/>
        <setting ref="appleMonitorIII.monitor" name="videoVerticalSize" label="Vertical Size" type="slider" options="0.8,1.2"/>
    </device>
    <connector id="appleMonitorIII.connector" type="Composite Video Port">
        <inlet ref="appleMonitorIII.monitor" property="controlBus" outletRef="controlBus"/>
    </connector>
    <component id="appleMonitorIII.monitor" class="Monitor">
        <property name="device" ref="appleMonitorIII"/>
        <property name="controlBus" ref="controlBus"/>
        <property name="videoDecoder" value="Monochrome"/>
        <property name="videoBrightness" value="0.1"/>
        <property name="videoContrast" value="0.75"/>
        <property name="videoSaturation" value="1.4"/>
        <property name="videoHue" value="0.33"/>
        <property name="videoHorizontalCenter" value="0"/>
        <property name="videoHorizontalSize" value="1.0"/>
        <property name="videoVerticalCenter" value="0"/>
        <property name="videoVerticalSize" value="1.0"/>
        <property name="videoBandwidth" value="15000000.0"/>
        <property name="displayBarrel" value="0.1"/>
        <property name="displayScanlineAlpha" value="0.5"/>
        <property name="displayCenterLighting" value="0.5"/>
        <property name="displayPersistance" value="0.9"/>
    </component>
    
</edl>
