<?xml version="1.0" encoding="UTF-8"?>
<!DOCTYPE edl PUBLIC "-//OPENEMULATOR//DTD EDL 1.0//EN" "http://www.openemulator.org/DTD/edl-1.0.dtd">
<edl version="1.0" label="Composite Video Monitor" image="Composite Video Monitor.png" group="Monitors">

<device id="monitor" type="Peripheral" label="Composite Video Monitor" image="Composite Video Monitor.png">
    <setting ref="monitor.monitor" name="brightness" type="value" options="0.0,2.0" label="Brightness" />
    <setting ref="monitor.monitor" name="contrast" type="value" options="0.0,2.0" label="Contrast" />
    <setting ref="monitor.monitor" name="saturation" type="value" options="0.0,2.0" label="Saturation" />
    <setting ref="monitor.monitor" name="hue" type="value" options="0.0,2.0" label="Hue" />
</device>
<connector id="monitor.connector" label="Video Connector" image="Composite Video Connector.png" />
<component id="monitor.monitor" class="CompositeMonitor">
    <property name="compositeLumaCutoff" value="0.3" />
    <property name="compositeChromaCutoff" value="0.06" />
    <property name="compositeHue" value="0.06" />
    <property name="compositeBrightness" value="0.06" />
    <property name="compositeColorize" value="0" />
    <property name="compositeDecoderMatrix" value="standard" />
    <property name="screenBrightness" value="0.0" />
    <property name="screenContrast" value="1.0" />
    <property name="screenRedGain" value="1.0" />
    <property name="screenGreenGain" value="1.0" />
    <property name="screenBlueGain" value="1.0" />
    <property name="screenBarrel" value="0.05" />
    <property name="screenPersistance" value="0.0" />
    <property name="screenHorizCenter" value="0.5" />
    <property name="screenHorizSize" value="1.0" />
    <property name="screenVertCenter" value="0.5" />
    <property name="screenVertSize" value="1.0" />
</component>

</edl>
