<?xml version="1.0" encoding="UTF-8"?>
<!DOCTYPE edl PUBLIC "-//OPENEMULATOR//DTD EDL 1.0//EN" "http://www.openemulator.org/DTD/edl-1.0.dtd">
<edl version="1.0" label="Apple Grahpics Tablet Interface Card" image="images/Apple/Apple Graphics Tablet Interface Card.png" description="The Apple Graphics Tablet Interface Card is used for connecting an Apple Graphics Tablet to an Apple II computer. It is usually installed in slot 5.">

<device id="appleGTIC" label="Apple Graphics Tablet Interface Card" image="images/Apple/Apple Graphics Tablet Interface Card.png" group="expansions" />
<connector id="appleGTIC.connector" ref="" type="Apple II Slot" label="Connector" >
    <inlet ref="appleGTIC.io" property="mmu" outletRef="mmu" />
</connector>
<port id="appleGTIC.port" ref="" type="Apple Graphics Tablet" label="Graphics Tablet Port" image="images/Connectors/Header1x6 Male.png">
</port>
<component id="appleGTIC.io" class="AppleLanguageCard">
    <property name="mmu" ref="" />
</component>
<component id="appleGTIC.memoryOffset" class="MemoryOffset">
    <property name="component" ref="languageCard.memory" />
</component>

</edl>
