<?xml version="1.0" encoding="UTF-8"?>
<!DOCTYPE edl PUBLIC "-//OPENEMULATOR//DTD EDL 1.0//EN" "http://www.openemulator.org/DTDs/edl-1.0.dtd">
<edl version="1.0" generator="OpenEmulator" framework="700" label="Apple-1" image="images/Apple/Apple-1.png" description="The Apple-1 is an early personal computer, and the first in combining a microprocessor with a connection for a keyboard and a monitor. It features a MOS 6502 microprocessor, 8 kiB RAM (at $0000-$0FFF and $E000-$EFFF), and 256 bytes ROM (at $FF00-$FFFF).">
    
    <device id="apple1" label="Apple-1" image="images/Apple/Apple-1.png">
        <setting ref="apple1.io" name="terminalSpeed" label="Terminal Speed" type="select" options="Standard,Enhanced"/>
        <setting ref="apple1.io" name="keyboardType" label="Keyboard" type="select" options="Standard,Full ASCII"/>
    </device>
    <port id="apple1.videoPort" ref="appleMonitorIII.connector" type="Composite Video Port" group="peripherals" label="Video Port" image="images/Connectors/RCA Female.png">
        <inlet ref="apple1.terminal" property="monitorDevice" outletRef=""/>
        <inlet ref="apple1.terminal" property="monitor" outletRef="monitor"/>
    </port>
    <port id="apple1.slot1" ref="" type="Apple-1 Expansion Port" group="expansions" label="Expansion Port" image="images/Connectors/Edge44.png"/>
    <port id="apple1.slot2" ref="" type="Apple-1 Expansion Port" group="expansions" label="Expansion Port" image="images/Connectors/Edge44.png"/>
    <component id="apple1.controlBus" class="ControlBus">
        <property name="device" ref="apple1"/>
        <property name="audio" ref="audio"/>
        <!-- Clock frequency: 14318180 Hz * 61 / 910 -->
        <property name="clockFrequency" value="959790.088"/>
        <property name="cpuClockMultiplier" value="1"/>
        <property name="cpu" ref="apple1.cpu"/>
        <property name="powerState" value="S0"/>
        <property name="resetOnPowerOn" value="1"/>
        <property name="resetCount" value="0"/>
        <property name="irqCount" value="0"/>
        <property name="nmiCount" value="0"/>
    </component>
    <component id="apple1.memoryBus" class="AddressDecoder">
        <property name="addressSize" value="16"/>
        <property name="blockSize" value="8"/>
        <property name="floatingBus" ref="apple1.floatingBus"/>
    </component>
    <component id="apple1.mmu" class="MMU">
        <property name="addressDecoder" ref="apple1.memoryBus"/>
        <property name="refRAM1" ref="apple1.ram1"/>
        <property name="mapRAM1" value="0x0000-0x0fff"/>
        <property name="refIO" ref="apple1.ioMemory"/>
        <property name="mapIO" value="0xd000-0xdfff"/>
        <property name="refRAM2" ref="apple1.ram2"/>
        <property name="mapRAM2" value="0xe000-0xefff"/>
        <property name="refROM" ref="apple1.rom"/>
        <property name="mapROM" value="0xf000-0xffff"/>
    </component>
    <component id="apple1.cpu" class="MOS6502">
        <property name="a" value="0x0"/>
        <property name="x" value="0x0"/>
        <property name="y" value="0x0"/>
        <property name="s" value="0x0"/>
        <property name="p" value="0x0"/>
        <property name="pc" value="0xff00"/>
        <property name="controlBus" ref="apple1.controlBus"/>
        <property name="memoryBus" ref="apple1.memoryBus"/>
    </component>
    <component id="apple1.floatingBus" class="FloatingBus">
        <property name="mode" value="ground"/>
    </component>
    <component id="apple1.ram1" class="RAM">
        <property name="controlBus" ref="apple1.controlBus"/>
        <property name="image" data="${packagePath}/${id}.bin"/>
        <property name="size" value="0x1000"/>
    </component>
    <component id="apple1.ioMemory" class="AddressDecoder">
        <property name="addressSize" value="5"/>
        <property name="blockSize" value="4"/>
        <property name="floatingBus" ref="apple1.floatingBus"/>
        <property name="refPIA" ref="apple1.pia"/>
        <property name="mapPIA" value="0x10-0x1f"/>
    </component>
    <component id="apple1.pia" class="MC6821">
        <property name="controlBus" ref="apple1.controlBus"/>
        <property name="portA" ref="apple1.io"/>
        <property name="controlA" value="0x0"/>
        <property name="directionA" value="0x0"/>
        <property name="dataA" value="0x0"/>
        <property name="ca1" value="0"/>
        <property name="ca2" value="0"/>
        <property name="controlBusA" ref=""/>
        <property name="portB" ref="apple1.io"/>
        <property name="controlB" value="0x0"/>
        <property name="directionB" value="0x0"/>
        <property name="dataB" value="0x0"/>
        <property name="cb1" value="0"/>
        <property name="cb2" value="0"/>
        <property name="controlBusB" ref=""/>
    </component>
    <component id="apple1.io" class="Apple1IO">
        <property name="terminalSpeed" value="Standard"/>
        <property name="keyboardType" value="Standard"/>
        <property name="pia" ref="apple1.pia"/>
        <property name="terminal" ref="apple1.terminal"/>
    </component>
    <component id="apple1.terminalRAM" class="RAM">
        <property name="controlBus" ref="apple1.controlBus"/>
        <property name="image" data="${packagePath}/${id}.bin"/>
        <property name="size" value="1024"/>
        <property name="powerOnPattern" value="0x20"/>
    </component>
    <component id="apple1.terminal" class="Apple1Terminal">
        <property name="cursorX" value="0"/>
        <property name="cursorY" value="0"/>
        <property name="device" ref="apple1"/>
        <property name="vram" ref="apple1.terminalRAM"/>
        <property name="controlBus" ref="apple1.controlBus"/>
        <property name="monitorDevice" ref="appleMonitorIII"/>
        <property name="monitor" ref="appleMonitorIII.monitor"/>
        <property name="font" data="${resourcePath}/roms/Signetics/Signetics 2513 Video ROM.bin"/>
    </component>
    <component id="apple1.ram2" class="RAM">
        <property name="controlBus" ref="apple1.controlBus"/>
        <property name="image" data="${packagePath}/${id}.bin"/>
        <property name="size" value="0x1000"/>
    </component>
    <component id="apple1.rom" class="ROM">
        <property name="image" data="${resourcePath}/roms/Apple/Apple-1 Monitor ROM.bin"/>
    </component>
    
    <device id="appleMonitorIII" label="Apple Monitor III" image="images/Apple/Apple Monitor III.png">
        <setting ref="appleMonitorIII.monitor" name="videoBrightness" label="Brightness" type="slider" options="-1.0,1.0"/>
        <setting ref="appleMonitorIII.monitor" name="videoContrast" label="Contrast" type="slider" options="0.0,1.0"/>
        <setting ref="appleMonitorIII.monitor" name="videoVerticalCenter" label="Vertical Center" type="slider" options="-0.1,0.1"/>
        <setting ref="appleMonitorIII.monitor" name="videoVerticalSize" label="Vertical Size" type="slider" options="0.85,1.25"/>
    </device>
    <connector id="appleMonitorIII.connector" type="Composite Video Port">
        <inlet ref="appleMonitorIII.monitor" property="controlBus" outletRef="controlBus"/>
    </connector>
    <component id="appleMonitorIII.monitor" class="Monitor">
        <property name="device" ref="appleMonitorIII"/>
        <property name="controlBus" ref="apple1.controlBus"/>
        <property name="videoDecoder" value="Monochrome"/>
        <property name="videoBrightness" value="0.15"/>
        <property name="videoContrast" value="0.8"/>
        <property name="videoSaturation" value="1.45"/>
        <property name="videoHue" value="0.27"/>
        <property name="videoHorizontalCenter" value="0"/>
        <property name="videoHorizontalSize" value="1.05"/>
        <property name="videoVerticalCenter" value="0"/>
        <property name="videoVerticalSize" value="1.05"/>
        <property name="videoBandwidth" value="4500000"/>
        <property name="displayBarrel" value="0.1"/>
        <property name="displayScanlineLevel" value="0.5"/>
        <property name="displayCenterLighting" value="0.5"/>
        <property name="displayPersistence" value="0.4"/>
        <property name="displayLuminanceGain" value="1.5"/>
    </component>
    
</edl>
